{
  "schema": "builddiag.report.v1",
  "tool": {
    "name": "builddiag",
    "version": "0.2.0"
  },
  "run": {
    "started_at": "2026-04-03T05:00:15.613698915Z",
    "ended_at": "2026-04-03T05:00:15.633582193Z",
    "duration_ms": 19,
    "host": {
      "os": "linux",
      "arch": "x86_64"
    },
    "git": {
      "commit": "13fcd4ee6d26e596f63b9815fa6f0e7b39f2a34d",
      "branch": "claude/fix-ci-parallel-agents-4NLDA",
      "dirty": true
    }
  },
  "verdict": "pass",
  "findings": [],
  "summary": {
    "total_findings": 0,
    "by_severity": {},
    "by_check": {}
  }
}