{
  "schema": "builddiag.report.v1",
  "tool": {
    "name": "builddiag",
    "version": "0.2.0"
  },
  "run": {
    "started_at": "2026-02-07T00:07:12.303119700Z",
    "ended_at": "2026-02-07T00:07:12.420484900Z",
    "duration_ms": 117,
    "host": {
      "os": "windows",
      "arch": "x86_64"
    },
    "git": {
      "commit": "a6942edde289735e935d1eb538c7bf2da3d28869",
      "branch": "main",
      "dirty": true
    }
  },
  "verdict": "pass",
  "findings": [
    {
      "check_id": "workspace.publish_ready",
      "code": "missing_description",
      "severity": "info",
      "message": "fixture-a: missing required 'description' field for publishing",
      "location": {
        "path": "crates/a/Cargo.toml"
      }
    },
    {
      "check_id": "workspace.publish_ready",
      "code": "missing_documentation",
      "severity": "info",
      "message": "fixture-a: missing recommended 'documentation' or 'homepage' field",
      "location": {
        "path": "crates/a/Cargo.toml"
      }
    },
    {
      "check_id": "workspace.publish_ready",
      "code": "missing_license",
      "severity": "info",
      "message": "fixture-a: missing required 'license' or 'license-file' field for publishing",
      "location": {
        "path": "crates/a/Cargo.toml"
      }
    },
    {
      "check_id": "workspace.publish_ready",
      "code": "missing_readme",
      "severity": "info",
      "message": "fixture-a: missing recommended 'readme' field",
      "location": {
        "path": "crates/a/Cargo.toml"
      }
    },
    {
      "check_id": "workspace.publish_ready",
      "code": "missing_repository",
      "severity": "info",
      "message": "fixture-a: missing recommended 'repository' field",
      "location": {
        "path": "crates/a/Cargo.toml"
      }
    }
  ],
  "summary": {
    "total_findings": 5,
    "by_severity": {
      "info": 5
    },
    "by_check": {
      "workspace.publish_ready": 5
    }
  }
}